{
  "schema_version": "deedseal.public-evidence-ledger/v1",
  "snapshot": {
    "id": "DS-2026.08.1",
    "prepared_on": "2026-08-04",
    "publication_status": "published"
  },
  "claims": [
    {
      "id": "CLM-0001",
      "statement": "A run can be admitted by a signed, scope-bound owner grant before controlled effects are accepted.",
      "component": "CORE",
      "status": "internally-verified",
      "observed_on": "2026-08-01",
      "scope": "DS-2026.08.1",
      "evidence_ids": [
        "EVD-CORE-0001"
      ],
      "limitations": [
        "Applies to the documented controlled-execution path, not arbitrary host activity."
      ]
    },
    {
      "id": "CLM-0002",
      "statement": "A current run passport binds authorization, custody outcome, execution identity, complete committed changes, artifact hashes, acceptance data, and final owner closure.",
      "component": "CORE",
      "status": "internally-verified",
      "observed_on": "2026-08-01",
      "scope": "DS-2026.08.1",
      "evidence_ids": [
        "EVD-CORE-0001"
      ],
      "limitations": [
        "The binding concerns process and provenance; it does not prove semantic correctness."
      ]
    },
    {
      "id": "CLM-0003",
      "statement": "The standalone run-passport verifier needs one passport file and no network, repository checkout, running service, private key, or third-party Python package.",
      "component": "CORE",
      "status": "internally-verified",
      "observed_on": "2026-08-01",
      "scope": "DS-2026.08.1",
      "evidence_ids": [
        "EVD-CORE-0001"
      ],
      "limitations": [
        "This claim was observed before the verifier was published; public reproducibility of the later published verifier and passport demonstration is tracked separately by CLM-0008."
      ]
    },
    {
      "id": "CLM-0004",
      "statement": "Repository-native dispatch binds immutable task bytes, bounded write scope, an execution-profile digest, and draft-only automation authority to an owner-selected commit.",
      "component": "OFFICE",
      "status": "internally-verified",
      "observed_on": "2026-08-01",
      "scope": "DS-2026.08.1",
      "evidence_ids": [
        "EVD-OFFICE-0001"
      ],
      "limitations": [
        "Internal schema, limits, credentials, and transports are not published."
      ]
    },
    {
      "id": "CLM-0005",
      "statement": "Postflight checks worker history and scope before publication; readiness, approval, and merge remain owner actions.",
      "component": "OFFICE",
      "status": "internally-verified",
      "observed_on": "2026-08-01",
      "scope": "DS-2026.08.1",
      "evidence_ids": [
        "EVD-OFFICE-0001"
      ],
      "limitations": [
        "Passing checks are evidence and do not constitute owner approval."
      ]
    },
    {
      "id": "CLM-0006",
      "statement": "Typed interruptions and recorded failures receive terminal dispositions; retry admits a closed failure set and reclaims prior worker state.",
      "component": "OFFICE",
      "status": "internally-verified",
      "observed_on": "2026-08-01",
      "scope": "DS-2026.08.1",
      "evidence_ids": [
        "EVD-OFFICE-0001"
      ],
      "limitations": [
        "Applies to the audited launcher implementation and its hermetic acceptance environment."
      ]
    },
    {
      "id": "CLM-0007",
      "statement": "An internal 10-entry controlled-execution series records eight positive lifecycles and two designed-negative lifecycles refused before effects.",
      "component": "CORE",
      "status": "internally-verified",
      "observed_on": "2026-08-01",
      "scope": "DS-2026.08.1",
      "evidence_ids": [
        "EVD-CORE-0002"
      ],
      "limitations": [
        "The public record is an aggregate; raw run artifacts are not distributed."
      ]
    },
    {
      "id": "CLM-0008",
      "statement": "A published run passport verifies PASS with the published offline verifier, and a one-byte tampered copy verifies BLOCK, using only this repository's files and a Python interpreter.",
      "component": "CORE",
      "status": "public-reproducible",
      "observed_on": "2026-08-02",
      "scope": "DS-2026.08.1",
      "evidence_ids": [
        "EVD-CORE-0003"
      ],
      "limitations": [
        "The verdict attests integrity and provenance of the recorded run against the trust anchors pinned in the published verifier; it does not attest semantic quality of the change the run produced.",
        "The demonstration covers one supervised run and one designed tamper case; it is not a general statement about product behavior or availability.",
        "Reproducing the verdict does not reproduce the run; producing new passports requires the private system and its signing keys."
      ]
    },
    {
      "id": "CLM-0009",
      "statement": "A second controlled run produced the precommitted target bytes, proved staged-to-materialized equality, and published those exact result bytes in this repository.",
      "component": "CORE",
      "status": "internally-verified",
      "observed_on": "2026-08-03",
      "scope": "DS-2026.08.1",
      "evidence_ids": [
        "EVD-CORE-0004"
      ],
      "limitations": [
        "The underlying grant and custody record remain private; the public record is a sanitized internal attestation, not a publicly reproducible run.",
        "No passport for this controlled run is published here; its record is a sanitized attestation. The separately published supervised-run passports under examples/verified/ are offline-checkable by a reader."
      ]
    },
    {
      "id": "CLM-0010",
      "statement": "The published verifier declares 39 refusal reasons; the published mutation corpus demonstrates 35 exact refusal verdicts and classifies 4 as not reachable by mutation of the published bytes.",
      "component": "PUBLIC",
      "status": "public-reproducible",
      "observed_on": "2026-08-03",
      "scope": "DS-2026.08.1",
      "evidence_ids": [
        "EVD-PUBLIC-0001"
      ],
      "limitations": [
        "The counts apply to the published verifier and corpus in this snapshot, not every refusal path in private components.",
        "Not reachable by published mutation is a statement about this passport and the verifier's fixed first-failure order; producing a differently signed record requires private signing keys.",
        "The corpus demonstrates exact refusal verdicts for published inputs; it does not establish completeness or semantic correctness."
      ]
    },
    {
      "id": "CLM-0011",
      "statement": "The boundary recorded in the published passport, applied on an unrelated Ubuntu runner's kernel, permits the recorded file write and refuses file creation, directory creation, symbolic-link creation, and unlink; continuous integration re-observes these operations on Ubuntu on every change.",
      "component": "PUBLIC",
      "status": "public-reproducible",
      "observed_on": "2026-08-03",
      "scope": "DS-2026.08.1",
      "evidence_ids": [
        "EVD-PUBLIC-0002"
      ],
      "limitations": [
        "The probe demonstrates the recorded ruleset's behavior on the reader's kernel, not the original execution.",
        "A kernel without Landlock cannot demonstrate the boundary and reports an explicit skip instead.",
        "The demonstration covers filesystem write classes only; it does not cover resource or network bounds."
      ]
    },
    {
      "id": "CLM-0012",
      "statement": "A second supervised run is published with its passport, its one-byte tampered twin, and the exact before and after bytes of the file it changed; the passport verifies PASS and the twin verifies BLOCK using only this repository's files and a Python interpreter.",
      "component": "CORE",
      "status": "public-reproducible",
      "observed_on": "2026-08-04",
      "scope": "DS-2026.08.1",
      "evidence_ids": [
        "EVD-CORE-0005"
      ],
      "limitations": [
        "The verdict attests integrity and provenance of the recorded run against the trust anchors pinned in the published verifier; it does not attest semantic quality of the change the run produced.",
        "Reproducing the verdict does not reproduce the run; producing new passports requires the private system and its signing keys."
      ]
    },
    {
      "id": "CLM-0013",
      "statement": "Two implementations of the published run-passport envelope produce identical verdicts and exit codes on all 48 published conformance vectors, and continuous integration re-observes this on every change.",
      "component": "PUBLIC",
      "status": "public-reproducible",
      "observed_on": "2026-08-04",
      "scope": "DS-2026.08.1",
      "evidence_ids": [
        "EVD-PUBLIC-0003"
      ],
      "limitations": [
        "Both implementations come from this project; this is agreement between two implementations, not two parties checking each other.",
        "Agreement covers the 48 published vectors and does not establish correctness for inputs outside them.",
        "Four declared refusal reasons cannot be reached by mutating the published bytes and are absent from the vectors."
      ]
    }
  ],
  "evidence": [
    {
      "id": "EVD-CORE-0001",
      "component": "CORE",
      "kind": "sanitized-internal-verification-summary",
      "assurance": "internal-ci-attestation",
      "observed_on": "2026-08-01",
      "source_snapshot": "CORE-2026-08-01-A",
      "artifact": {
        "path": "evidence/records/EVD-CORE-0001.json",
        "sha256": "feea9e7b4d61bdf1f8c6b8cac56d97e1d50fe900869f56a14f000390896d23f2"
      },
      "redactions": [
        "R-IP",
        "R-OPS",
        "R-SEC"
      ],
      "limitations": [
        "Private source and CI are summarized, not published."
      ]
    },
    {
      "id": "EVD-CORE-0002",
      "component": "CORE",
      "kind": "sanitized-controlled-series-summary",